<?xml version="1.0" encoding="UTF-8"?>
<?xml-stylesheet type="text/xsl" href="acquisti.xsl"?>
<d:acquisti xmlns="http://www.empirecon.it" xmlns:xs="http://www.w3.org/2001/XMLSchema-instance" xmlns:d="http://www.empirecon.it" xs:schemaLocation="http://www.enpirecon.it acquisti.xsd">

<tipologia id="intero" prezzo="25">
	<acquisto username="sydernee" datatime="2014-08-08T00-16-42">3</acquisto>
	<acquisto username="sydernee" datatime="2014-08-08T00-18-13">1</acquisto>
	<acquisto username="sydernee" datatime="2014-08-08T00-20-11">9</acquisto>
	<acquisto username="sydernee" datatime="2014-08-08T05-15-46">1</acquisto>
	<acquisto username="sydernee" datatime="2014-08-08T09-43-37">1</acquisto>
</tipologia>
  
<tipologia id="ridotto" prezzo="5">
	<acquisto username="sydernee" datatime="2014-08-08T00-19-57">6</acquisto>
	<acquisto username="sydernee" datatime="2014-08-08T00-20-23">2</acquisto>
</tipologia>

<tipologia id="gratis" prezzo="0">
	<acquisto username="sydernee" datatime="2014-08-08T00-20-39">4</acquisto>
	<acquisto username="sydernee" datatime="2014-08-08T05-06-32">3</acquisto>
	<acquisto username="sydernee" datatime="2014-08-08T05-07-57">1</acquisto>
</tipologia>
</d:acquisti>
